{
  "$schema": "../../../../../../schemas/package_manifest.schema.json",
  "schema_version": "1.0.0",
  "content_version": "1.0.0",
  "module_id": "physics",
  "section_id": "motion",
  "package_id": "page_002",
  "title": "Motion Page 002",
  "summary": "Projectile motion lab introduction.",
  "parts": [
    {
      "part_id": "projectile_demo",
      "part_type": "simulation",
      "manifest_path": "parts/projectile_demo/part_manifest.json",
      "order": 1
    }
  ]
}
