{
  "$schema": "../../../../../../schemas/package_manifest.schema.json",
  "schema_version": "1.0.0",
  "content_version": "1.0.0",
  "module_id": "physics",
  "section_id": "optics",
  "package_id": "page_001",
  "title": "Optics Page 001",
  "summary": "Basics of light rays and reflection.",
  "parts": [
    {
      "part_id": "light_intro",
      "part_type": "text",
      "manifest_path": "parts/light_intro/part_manifest.json",
      "order": 1
    },
    {
      "part_id": "lens_ray_demo",
      "part_type": "simulation",
      "manifest_path": "parts/lens_ray_demo/part_manifest.json",
      "order": 2
    }
  ]
}
