{
  "$schema": "../../../../../../schemas/package_manifest.schema.json",
  "schema_version": "1.0.0",
  "content_version": "1.0.0",
  "module_id": "physics",
  "section_id": "electricity",
  "package_id": "page_001",
  "title": "Electricity Page 001",
  "summary": "Charge, current, and simple circuits.",
  "parts": [
    {
      "part_id": "charge_intro",
      "part_type": "text",
      "manifest_path": "parts/charge_intro/part_manifest.json",
      "order": 1
    }
  ]
}
