{
  "$schema": "../../../../../../schemas/package_manifest.schema.json",
  "schema_version": "1.0.0",
  "content_version": "1.0.0",
  "module_id": "physics",
  "section_id": "vectors",
  "package_id": "page_001",
  "title": "Vectors Page 001",
  "summary": "Vectors, components, and simple addition.",
  "parts": [
    {
      "part_id": "vectors_intro",
      "part_type": "text",
      "manifest_path": "parts/vectors_intro/part_manifest.json",
      "order": 1
    },
    {
      "part_id": "vector_add_demo",
      "part_type": "simulation",
      "manifest_path": "parts/vector_add_demo/part_manifest.json",
      "order": 2
    }
  ]
}
