{
  "$schema": "../../../../../../schemas/package_manifest.schema.json",
  "schema_version": "1.0.0",
  "content_version": "1.0.0",
  "module_id": "physics",
  "section_id": "motion",
  "package_id": "page_001",
  "title": "Motion Page 001",
  "summary": "Intro text followed by a simple gravity drop demo.",
  "parts": [
    {
      "part_id": "text_intro",
      "part_type": "text",
      "manifest_path": "parts/text_intro/part_manifest.json",
      "order": 1
    },
    {
      "part_id": "gravity_demo",
      "part_type": "simulation",
      "manifest_path": "parts/gravity_demo/part_manifest.json",
      "order": 2
    }
  ]
}
